{
  "$schema": "../schemas/status-effects-catalog.schema.json",
  "version": "2.0.0",
  "generatedAt": "2026-10-08T09:00:00.000Z",
  "description": "Authoritative Granblue Fantasy status effects catalog, covering boss buffs (dispel priority), party debuffs (cleanse priority), dispel/cleanse asset taxonomy, and autonomous survival decision rules.",
  "bossBuffs": [
    {
      "id": "damage_cut_100",
      "name": "100% Damage Cut / Absolute Barrier",
      "japaneseName": "全属性ダメージカット 100%",
      "category": "defensive",
      "dispelPriority": "immediate",
      "removable": true,
      "threatLevel": "high",
      "description": "Reduces all incoming elemental damage to 0. Must be dispelled immediately before any burst attack or damage skill dispatch.",
      "commonBosses": ["Lucilius", "Belial", "Grand Order HL", "Six Dragons"]
    },
    {
      "id": "repel",
      "name": "Repel (Damage Reflection)",
      "japaneseName": "反射",
      "category": "defensive",
      "dispelPriority": "immediate",
      "removable": true,
      "threatLevel": "wipe",
      "description": "Reflects a percentage of incoming damage directly back to attacking party members. Attacking into high-potency Repel causes instant team suicide.",
      "commonBosses": ["Colossus Omega", "Colossus Ira", "Apollo", "Rose Queen"]
    },
    {
      "id": "mirror_image",
      "name": "Mirror Image (Other Self)",
      "japaneseName": "幻影",
      "category": "defensive",
      "dispelPriority": "immediate",
      "removable": true,
      "threatLevel": "medium",
      "description": "Evades incoming single-target attacks. Absorbs full skill damage nukes. Dispel or multi-hit AoE required to strip.",
      "commonBosses": ["Tiamat Omega", "Tiamat Aura", "Ewiyar", "Grand Order"]
    },
    {
      "id": "elemental_absorption",
      "name": "Elemental Absorption / Healing Guard",
      "japaneseName": "属性吸収",
      "category": "defensive",
      "dispelPriority": "immediate",
      "removable": true,
      "threatLevel": "wipe",
      "description": "Converts all incoming elemental damage into boss HP recovery. Attacking during absorption heals the boss back to full HP.",
      "commonBosses": ["Lucilius (Hard) Wing Phase", "Belial 50%", "Hexachromatic Hierarch"]
    },
    {
      "id": "tri_slash",
      "name": "Tri-Slash / Quad-Slash (Multi-Strike)",
      "japaneseName": "乱打 / 連撃激化",
      "category": "offensive",
      "dispelPriority": "high",
      "removable": true,
      "threatLevel": "wipe",
      "description": "Boss attacks 3 or 4 times per turn with catastrophic normal attack potency. Capable of shredding frontline in a single turn.",
      "commonBosses": ["Wilnas", "Colossus Ira", "Siete (Revans)", "Agastia"]
    },
    {
      "id": "uplift",
      "name": "Uplift (Charge Diamond Acceleration)",
      "japaneseName": "高揚",
      "category": "utility",
      "dispelPriority": "high",
      "removable": true,
      "threatLevel": "high",
      "description": "Increases boss charge diamonds by 1 or more extra diamonds at the end of each turn, dramatically accelerating special attack / omen triggers.",
      "commonBosses": ["Proto Bahamut HL", "Akasha", "Wilnas", "Luminiera Credo"]
    },
    {
      "id": "def_up_50",
      "name": "50% DEF Up / Fortification",
      "japaneseName": "防御力UP (50%)",
      "category": "defensive",
      "dispelPriority": "high",
      "removable": true,
      "threatLevel": "medium",
      "description": "Dramatically lowers player damage output, preventing omen damage thresholds and extending fight duration.",
      "commonBosses": ["Yggdrasil Arbos", "Leviathan Mare", "Lindwurm HL"]
    },
    {
      "id": "supplemental_damage_boss",
      "name": "Supplemental Damage (Boss)",
      "japaneseName": "与ダメージ上昇",
      "category": "offensive",
      "dispelPriority": "normal",
      "removable": true,
      "threatLevel": "medium",
      "description": "Adds flat bonus damage per hit to all multi-hit boss normal attacks and special moves.",
      "commonBosses": ["Fediel", "Lu Woh", "Tiamat Aura"]
    },
    {
      "id": "undispellable_aura",
      "name": "Transcendent / Golden Border Buff",
      "japaneseName": "消去不可バフ",
      "category": "special",
      "dispelPriority": "ignore",
      "removable": false,
      "threatLevel": "high",
      "description": "Permanent boss mechanic buff marked with a golden border. Immune to all Dispel effects. Automation must NOT waste dispel skills.",
      "commonBosses": ["Super Ultimate Bahamut", "Dark Rapture Zero", "Siete Revans"]
    }
  ],
  "partyDebuffs": [
    {
      "id": "zombified",
      "name": "Zombified (Undead)",
      "japaneseName": "アンデッド / ゾンビ",
      "category": "special",
      "cleansePriority": "immediate",
      "cleanseable": true,
      "blockableByVeil": true,
      "threatLevel": "wipe",
      "description": "CRITICAL LETHAL: Converts all incoming healing into true Plain Damage. Drinking a Green Potion or activating a Heal skill causes instant party wipe.",
      "incompatibleActions": ["green_potion", "all_potion", "heal_skill", "drain_attack", "revive"]
    },
    {
      "id": "paralysis",
      "name": "Paralysis / Stun",
      "japaneseName": "麻痺 / 行動不能",
      "category": "lockout",
      "cleansePriority": "immediate",
      "cleanseable": true,
      "blockableByVeil": true,
      "threatLevel": "wipe",
      "description": "Renders affected party members completely unable to take actions, attack, use skills, or guard.",
      "incompatibleActions": ["normal_attack", "skill_dispatch"]
    },
    {
      "id": "petrified",
      "name": "Petrified (Charge Bar Freeze)",
      "japaneseName": "石化 / 恐怖",
      "category": "lockout",
      "cleansePriority": "high",
      "cleanseable": true,
      "blockableByVeil": true,
      "threatLevel": "high",
      "description": "Freezes charge bar accumulation at 0%, preventing charge attacks and fatal chain formation.",
      "incompatibleActions": ["charge_attack_burst"]
    },
    {
      "id": "skill_seal",
      "name": "Skill Seal / Silenced",
      "japaneseName": "アビリティ封印",
      "category": "lockout",
      "cleansePriority": "immediate",
      "cleanseable": true,
      "blockableByVeil": true,
      "threatLevel": "wipe",
      "description": "Completely prevents casting any ability across all cooldowns. Must be cleansed immediately via summon or auto-cleanse.",
      "incompatibleActions": ["skill_dispatch"]
    },
    {
      "id": "ca_seal",
      "name": "C.A. Seal / Charge Attack Blocked",
      "japaneseName": "奥義封印",
      "category": "lockout",
      "cleansePriority": "high",
      "cleanseable": true,
      "blockableByVeil": true,
      "threatLevel": "high",
      "description": "Prevents unleashing Charge Attacks even when charge bar is 100%. Blocks C.A. omen cancelation.",
      "incompatibleActions": ["charge_attack_burst"]
    },
    {
      "id": "strong_poison",
      "name": "Strong Poison / Putrefy / Death Rot",
      "japaneseName": "強毒 / 腐食 / 灼熱",
      "category": "lethal_dot",
      "cleansePriority": "high",
      "cleanseable": true,
      "blockableByVeil": true,
      "threatLevel": "high",
      "description": "Deals massive percentage-based end-of-turn plain damage (15% to 25% max HP per turn), quickly bleeding the party to lethal thresholds.",
      "incompatibleActions": []
    },
    {
      "id": "charm_confuse",
      "name": "Charm / Confuse",
      "japaneseName": "魅了 / 混乱",
      "category": "offensive_penalty",
      "cleansePriority": "normal",
      "cleanseable": true,
      "blockableByVeil": true,
      "threatLevel": "medium",
      "description": "High chance for party members to skip their turn or attack fellow party members.",
      "incompatibleActions": []
    },
    {
      "id": "def_down_party",
      "name": "DEF Down / Armor Shattered",
      "japaneseName": "防御力DOWN",
      "category": "defensive_penalty",
      "cleansePriority": "normal",
      "cleanseable": true,
      "blockableByVeil": true,
      "threatLevel": "medium",
      "description": "Lowers party defense by 20% to 50%, amplifying incoming boss damage significantly.",
      "incompatibleActions": []
    }
  ],
  "dispelSources": {
    "summons": [
      {
        "id": "beelzebub",
        "name": "Beelzebub (4★)",
        "callName": "Chaos Void",
        "dispelsCount": 3,
        "conditions": "Main Character Trance Level >= 1 (deals 3 dispels instantly)",
        "priorityScore": 100
      },
      {
        "id": "michael",
        "name": "Michael (4★)",
        "callName": "Ignis Iudicium",
        "dispelsCount": 1,
        "conditions": "Can be called on Turn 1 if equipped as Main or Friend; dispels 1 buff and inflicts Delay",
        "priorityScore": 90
      },
      {
        "id": "lucifer_250",
        "name": "Lucifer (Transcendence Lv 250)",
        "callName": "Paradise Lost +",
        "dispelsCount": 1,
        "conditions": "Dispels 1 buff from all foes and restores 3,000 HP to all allies",
        "priorityScore": 88
      },
      {
        "id": "yatagarasu",
        "name": "Yatagarasu (4★)",
        "callName": "Corvine Eclipse",
        "dispelsCount": 2,
        "conditions": "Deals 2 dispels to all foes on call",
        "priorityScore": 85
      },
      {
        "id": "metatron",
        "name": "Metatron (4★)",
        "callName": "Cosmic Judgement",
        "dispelsCount": 1,
        "conditions": "Dispels 1 buff and inflicts Dark ATK Down and Light DEF Down",
        "priorityScore": 80
      }
    ],
    "mcSkills": [
      {
        "id": "mc_dispel",
        "name": "Dispel",
        "classCategory": "Sorcerer Sub-Skill / Universal",
        "dispelsCount": 1,
        "cooldownTurns": 5,
        "notes": "Standard single-target dispel accessible to any Class IV / Row V job."
      },
      {
        "id": "manadiver_leviathan_minit",
        "name": "Manadiver (Leviathan Minit Passive)",